{
  "kind": "task.origin",
  "id": "quant-preregister",
  "spec": "2origin/0.2",
  "version": 9,
  "updated_at": "2026-08-10T18:35:43.721Z",
  "title": "回测挖掘对照：预注册能否挡住凭空造出来的 alpha",
  "goal": "在真实 alpha 已知为零的合成数据上量出参数挖掘的溢价，并让『我没有事后调参』这句话可被陌生人独立核验。",
  "current_state": "两轮跑完。v2（608 组网格）：F=0.382，E[max SR]=0.479，DSR 余量由 0.016 扩大到 0.097（六倍）——试得越多，挖出的夏普涨得比噪声上限慢，所以 DSR 更判得住。R2/R3/R4 成立，R1 仍不成立且就此停止加大网格（再加就是试到过为止）。",
  "facts": [
    {
      "claim": "PREREGISTRATION.md 的 sha256 = b1b3851f1dc634f6cce21a83163c5acf5f7c6726c5bea8ec79cff0839931cd9f",
      "verified": true,
      "source": "node benxiang/observe.mjs demo/quant-preregister/PREREGISTRATION.md"
    },
    {
      "claim": "prereg.json 的 sha256 = b54fd2825858deb9a334f5867b4b8240150a49f4a5d035e935e5f69efc4222cd",
      "verified": true,
      "source": "node benxiang/observe.mjs demo/quant-preregister/prereg.json"
    },
    {
      "claim": "backtest.mjs 的 sha256 = 7dc8ac547f05f32564c9c52dd67583a1e7dbdf82f446642669aa09c7ffcd09dd",
      "verified": true,
      "source": "node benxiang/observe.mjs demo/quant-preregister/backtest.mjs"
    },
    {
      "claim": "数据是零漂移几何布朗运动，真 alpha 严格为 0；任何显著为正的夏普都是可数的假阳性",
      "verified": true,
      "source": "demo/quant-preregister/prereg.json"
    },
    {
      "claim": "跑手启动时自校验 prereg.json 哈希，与预注册承诺不符则退出码 3 拒跑",
      "verified": true,
      "source": "demo/quant-preregister/backtest.mjs"
    },
    {
      "claim": "F 臂夏普 0.303 落在纯噪声下 36 次试验的期望最大夏普 0.319 之内 —— Deflated Sharpe 判定该成绩是挖出来的",
      "verified": true,
      "source": "demo/quant-preregister/RESULTS.json"
    },
    {
      "claim": "R3 挖掘溢价实测 0.494855，预注册阈值 0.5，差 0.005145 判不通过",
      "verified": true,
      "source": "demo/quant-preregister/RESULTS.json"
    },
    {
      "claim": "跑手修 R1 索引 bug 后重跑，除 verdicts 外与首跑全文逐位相同",
      "verified": true,
      "source": "node -e 比对 RESULTS-run1.json 与 RESULTS.json"
    },
    {
      "claim": "backtest.mjs 修改后 sha256 = be413bbd93030802ea867d55dbbc9878ccbb4585b75bfd0265d476aba913e06a，锚点 63d46b16fc99c421 中记录的是修改前的 7dc8ac54…",
      "verified": true,
      "source": "node benxiang/observe.mjs demo/quant-preregister/backtest.mjs"
    },
    {
      "claim": "字段级写入 patchState 已落成：append 走 CAS 重试循环，两个并发追加都能活",
      "verified": true,
      "source": "node southbridge/verify-benjing.mjs 判据 B15.1"
    },
    {
      "claim": "第二轮预注册 PREREGISTRATION-v2.md 的 sha256 = df0c28af8e44b69d67eaf6570bb341dc54211b6cf2c5b15167dfd9bcca3fdeea",
      "verified": true,
      "source": "node benxiang/observe.mjs demo/quant-preregister/PREREGISTRATION-v2.md"
    },
    {
      "claim": "第二轮 prereg-v2.json 的 sha256 = 0354049996de1306f84e28dd3ad45412135f99b65faa827506c6967409601f57，网格 608 组",
      "verified": true,
      "source": "node benxiang/observe.mjs demo/quant-preregister/prereg-v2.json"
    },
    {
      "claim": "backtest-v2.mjs 的 sha256 = 4881f3aacd94205a653b627021388adc1b33d45b91a2a9505dc094b1eb01363a",
      "verified": true,
      "source": "node benxiang/observe.mjs demo/quant-preregister/backtest-v2.mjs"
    },
    {
      "claim": "§4 复算通过：v2 的 O(n) 滑动窗口实现以 v1 网格跑出的 summary/rows/failures 与第一轮 RESULTS.json 逐位相同，优化未改变语义",
      "verified": true,
      "source": "QUANT_GRID=v1 node demo/quant-preregister/backtest-v2.mjs 后比对 RESULTS-v2-recheck.json 与 RESULTS.json"
    },
    {
      "claim": "第二轮只改网格一个变量（36→608），数据/种子/切分/成本/策略/判定阈值全部未动",
      "verified": true,
      "source": "demo/quant-preregister/PREREGISTRATION-v2.md"
    }
  ],
  "decisions": [
    {
      "what": "数据用合成随机游走，不用真实行情",
      "why": "真 alpha 必须已知，否则挖出来的 alpha 与真的 alpha 分不开，实验退化成又一份无法裁决的业绩报告。代价（不能说明真实市场假阳性率）写进 PREREGISTRATION.md 第七节。"
    },
    {
      "what": "判定规则以机器可读形式写进 prereg.json，由跑手自动裁决",
      "why": "结论不由跑完之后的文字叙事给出——那是事后归因的入口。"
    },
    {
      "what": "三份预注册文件的哈希放进本学历，而不是改 anchor 的 INCLUDE_RULES",
      "why": "anchor 在 demo/ 下只收录 task.origin.json。改治理机制是更大的动作，先用现有范围间接固定内容；是否把预注册文件升为一等锚定对象另议。"
    },
    {
      "what": "R1/R3 不成立照原样报告，不调阈值、不用未预注册的量补救",
      "why": "临界值面前把话说圆正是预注册要防的动作。R3 差 0.005145 这件事本身比它成立更有说服力。"
    }
  ],
  "next_steps": [
    "STEP-1 提交预注册与跑手（结果尚不存在）— done",
    "STEP-2 anchor stamp 封存 63d46b16fc99c421 — done",
    "STEP-3 跑回测 — done",
    "STEP-4 写 RESULTS.md — done",
    "STEP-5 1~24h 后 node governance/anchor.mjs upgrade 把日历承诺升级为区块证明",
    "STEP-6 若要回答 R1（加大网格），需要一份新的预注册和一次新的盖章，不能在本份结果上续写"
  ],
  "artifacts": [
    "demo/quant-preregister/PREREGISTRATION.md",
    "demo/quant-preregister/prereg.json",
    "demo/quant-preregister/backtest.mjs",
    "demo/quant-preregister/RESULTS.md",
    "demo/quant-preregister/RESULTS.json",
    "demo/quant-preregister/RESULTS-run1.json"
  ],
  "content_hash": "0f8f9e9dddaaa8e1463d988cb07f08c6b09d6c43d6dd52b8ed54420182130072",
  "actor": {
    "harness": "claude-code",
    "model": "claude-opus-5",
    "model_source": "transcript",
    "session_id": "dab721c6-5329-48ed-9915-6d87dc3aca62",
    "at": "2026-08-10T18:35:43.721Z"
  }
}