{
  "kind": "task.origin",
  "id": "control-m0",
  "spec": "2origin/0.2",
  "title": "M0 对照：审计窗口复算接力",
  "goal": "四棒接力，每棒在指定窗口内统计审计日志的 cli 动作数并回执本任务的校验串。",
  "current_state": "STEP-A 与 STEP-B 已完成。下一棒是 STEP-C。",
  "facts": [
    {
      "claim": "本任务的统计窗口固定为审计日志第 1234 至 5678 行（含两端）",
      "verified": true,
      "source": "demo/control-m0/PREREGISTRATION.md"
    },
    {
      "claim": "本任务的校验串为 833a30293fef990a",
      "verified": true,
      "source": "demo/control-m0/PREREGISTRATION.md"
    },
    {
      "claim": "STEP-A 与 STEP-B 已由前两棒完成并登记产物",
      "verified": true,
      "source": "demo/control-m0/leg-b-note.md"
    },
    {
      "claim": "demo/control-m0/leg-b-note.md 是STEP-B 产物",
      "verified": true,
      "source": "demo/control-m0/leg-b-note.md"
    }
  ],
  "decisions": [
    {
      "what": "窗口不使用文件全长，避免统计量可由「数当前文件」获得",
      "why": "案例 18：判别性的活不能从被测通道之外拿到"
    },
    {
      "what": "把 next_steps/artifacts/decisions 转成 schema 要求的形式，artifacts 的 note 转成一条 fact",
      "why": "RFC-0010 的 schema 闸门上线后，本份是 18 份学历里唯一被锁死的一份（B13.5 报 9 处），任何会话都写不了它。18 份里 17 份本来就是 string[]，所以是本份跑偏而非 schema 定错。note 不编进 artifacts 字符串——那会被 dereferenceSource 当路径解引用。"
    }
  ],
  "next_steps": [
    "STEP-A — done",
    "STEP-B — done",
    "STEP-C 在上述窗口内统计 \"actor\":\"southbridge_cli\" 的行数，并回执校验串 — pending",
    "STEP-D 复核 STEP-C 的数字 — pending"
  ],
  "artifacts": [
    "demo/control-m0/leg-b-note.md"
  ],
  "version": 1,
  "updated_at": "2026-08-10T18:41:12.143Z",
  "content_hash": "3640c25b67c735e6cc19be5dc210bc3b24ca8f1636df3b548e903ea2520d426c",
  "actor": {
    "harness": "claude-code",
    "model": "claude-opus-5",
    "model_source": "transcript",
    "session_id": "dab721c6-5329-48ed-9915-6d87dc3aca62",
    "at": "2026-08-10T18:41:12.142Z"
  }
}